{
  "$schema": "https://json-schema.org/draft/2020-12/schema",
  "title": "agent-surface asset category",
  "type": "object",
  "required": [
    "category",
    "skills",
    "commands",
    "rules",
    "subagents",
    "services"
  ],
  "properties": {
    "category": {
      "enum": [
        "development",
        "cybersecurity",
        "private",
        "modding"
      ]
    },
    "skills": {
      "type": "array",
      "uniqueItems": true,
      "items": {
        "type": "string",
        "pattern": "^[a-z0-9][a-z0-9-]*$"
      }
    },
    "commands": {
      "type": "array",
      "uniqueItems": true,
      "items": {
        "type": "string",
        "pattern": "^[a-z0-9][a-z0-9-]*$"
      }
    },
    "rules": {
      "type": "array",
      "uniqueItems": true,
      "items": {
        "type": "string",
        "pattern": "^[a-z0-9][a-z0-9-]*$"
      }
    },
    "subagents": {
      "type": "array",
      "uniqueItems": true,
      "items": {
        "type": "string",
        "pattern": "^[a-z0-9][a-z0-9-]*$"
      }
    },
    "services": {
      "type": "array",
      "uniqueItems": true,
      "items": {
        "type": "string",
        "pattern": "^[a-z0-9][a-z0-9-]*$"
      }
    }
  },
  "additionalProperties": false
}
