{
  "category": "development",
  "skills": [
    "arch-contract",
    "arch-diagram",
    "arch-roadmap",
    "boot-concept",
    "boot-context",
    "boot-new",
    "boot-repro",
    "boot-workflow",
    "dev-chore",
    "dev-converge",
    "dev-core",
    "dev-feature",
    "dev-fix",
    "dev-refactor",
    "dev-spec",
    "lint-go",
    "lint-kernel",
    "lint-python",
    "lint-rust",
    "lint-shell",
    "lint-typescript",
    "ops-clean",
    "ops-deps",
    "ops-doctor",
    "ops-flow",
    "qa-audit",
    "qa-measure",
    "qa-review",
    "qa-self-critique",
    "qa-trace",
    "ship-artifact",
    "ship-cicd",
    "verify-coverage",
    "verify-edge",
    "verify-performance",
    "verify-prove",
    "verify-readiness",
    "verify-test",
    "workflow-boss",
    "workflow-close",
    "workflow-doctor",
    "workflow-judger",
    "workflow-orchestrator",
    "workflow-rescue",
    "workflow-reviewer",
    "workflow-runtime"
  ],
  "commands": [
    "boot-facade",
    "ops-nuke",
    "ship-commit",
    "ship-deploy",
    "ship-release"
  ],
  "rules": [
    "02-agent-workflow",
    "03-project-defaults",
    "05-tooling",
    "06-test-policy",
    "10-python",
    "11-rust",
    "12-go",
    "13-typescript",
    "14-shell"
  ],
  "subagents": [
    "adversary",
    "analyzer",
    "boss",
    "researcher",
    "reviewer",
    "worker"
  ],
  "services": [
    "archify",
    "chrome-devtools",
    "sanyuan-development-skills"
  ]
}
